BANH_AFC_1,Bánh cracker vị lúa mì AFC Dinh Dưỡng hộp 172g,30500,18 × 10 × 3 cm
BANH_AFC_2,Bánh cracker vị rau AFC Dinh Dưỡng hộp 172g,31000,18 × 10 × 3 cm
BANH_AN_11,Bánh gạo nướng vị tảo biển Orion An gói 159g,45000,16 × 9 × 2 cm
BANH_BON_3,Bánh bông lan sợi thịt gà Orion C'est Bon gói 85g (5 cái x 17g),20000,"14 × 8 × 2,5 cm"
BANH_CHOCOPIE_7,Bánh chocopie Orion hộp 66g (2 cái),45000,12 × 7 × 3 cm
BANH_COFFETOY_6,Bánh quy vị cà phê Coffee Joy hộp 156g,27000,17 × 11 × 2.5 cm
BANH_COSY_16,Bánh quế vị kem socola Cosy gói 117.6g,14500,16 × 9 × 2 cm
BANH_COSY_17,Bánh quy nhân mứt thơm Cosy hộp 240g,45000,20 × 12 × 3 cm
BANH_CUSTAS_8,BÁNH TRỨNG CAO CẤP CUSTARD 25k,25000,15 × 9 × 3 cm
BANH_CUSTAS_9,Bánh kem trứng Custas hộp 470g (20 cái),45000,25 × 17 × 5 cm
BANH_DANISA_18,Bánh quy bơ Danisa hộp 681g,45000,23 × 23 × 16 cm
BANH_DANISA_19,Bánh quy bơ Danisa hộp 681g,45000,23 × 23 × 16 cm
BANH_GOODY_20,Bánh quy bơ hỗn hợp Goody cao cấp hộp 454g,45000,20 × 20 × 13 cm
BANH_GOUTE_13,Bánh quy mè Gouté hộp 288g,45000,18 × 12 × 4 cm
BANH_HURA_4,Bánh bông lan hương sữa dâu Hura Deli hộp 168g (6 cái),31000,16 × 9 × 4 cm
BANH_ICHI_12,Bánh gạo Nhật vị Shouyu mật ong Ichi gói 100g,21000,15 × 10 × 2 cm
BANH_KITKAT_14,Bánh xốp phủ socola KitKat gói 35g,45000,13 × 7 × 2 cm
BANH_MARINEBOY_5,Snack Orion - Bánh Jungle Boy/ Marine Boy hộp 35g,10500,14 × 8 × 2 cm
BANH_NABATI_15,Bánh xốp nhân phô mai Nabati hộp 300g,45000,22 × 12 × 4 cm
BANH_OSTAR_21,Bánh Snack Khoai Tây 35g,6000,13 × 8 × 2 cm
BANH_OSTAR_22,Snack khoai tây vị kim chi Hàn Quốc O'Star gói 55g,12000,15 × 10 × 3 cm
BANH_OSTAR_23,Snack khoai tây vị tự nhiên O'Star gói 55g,12000,15 × 10 × 3 cm
BANH_OSTAR_24,Snack khoai tây vị phô mai trứng muối O'Star gói 90g,22000,18 × 12 × 4 cm
BANH_OSTAR_25,Snack khoai tây vị tảo biển O'Star gói 55g,12000,15 × 10 × 3 cm
BANH_VIFON_10,Bánh đa cua Vifon gói 60g,45000,14 × 10 × 3 cm
BCS_DUREX_26,Hộp 12 cái bao cao su Durex Fetherlite Ultima 52mm,45000,12 × 6 × 3 cm
BCS_DUREX_27,Bao Cao Su Durex Invisible hộp 3 gói,92000,7 × 7 × 3 cm
BCS_DUREX_28,Bao Cao Su Durex Chocolate (3s) - Gai Nhỏ - Hương Socola - Nhập Khẩu Ấn Độ,99000,7 × 7 × 3 cm
BCS_DUREX_29,"Bao cao su Durex Pleasuremax, Hộp 03 cái",62000,18 × 10 × 3 cm
BIA_LAGER_30,Bia Sài Gòn Lager 330ml,45000,6 × 6 × 12 cm
BIA_TIGER_31,Bia Tiger lon 250ml,45000,5.5 × 5.5 × 11.5 cm
CAFE_CAFEVIET_34,Cà phê đen đá NesCafé Café Việt 240g,45000,17 × 11 × 4 cm
CAFE_G7_33,Cà phê sữa G7 3 in 1 336g,45000,18 × 12 × 5 cm
CAFE_HUUKHANH_35,Cà phê Hữu Khánh 500g,110000,20 × 12 × 6 cm
CAFE_HUUKHANH_36,Cà phê Hữu Khánh 500g,110000,20 × 12 × 6 cm
CAFE_NESCAFE_37,Hộp cà phê NesCafe 3 in1 đậm đà xanh,54800,18 × 12 × 5 cm
CAFE_TRUNGNGUYEN_38,Cà phê Trung Nguyên I khát vọng khởi nghiệp 500g,105000,20 × 13 × 6 cm
CAFE_VINACAFE_39,Cà Phê Sữa Vinacafe Gold 800g - Bịch 40 gói x 20gr,98000,23 × 16 × 6 cm
CAFE_WAKEUP_40,Cà phê sữa Wake Up Café Sài Gòn 456g,52000,22 × 15 × 7 cm
CAFE_WAKEUP_41,Cà phê sữa Wake Up 3 trong 1 hương chồn 306g,45000,18 × 12 × 5 cm
CAFE_WAKEUP_42,Cà phê sữa Wake Up Café Sài Gòn 456g,52000,22 × 15 × 7 cm
DAUAN_MARVELA_43,Dầu thực vật bổ sung vitamin A & D3 Marvela chai 1 lít,45000,27 × 8 × 8 cm
DAUAN_SIMPLY_44,Dầu đậu nành nguyên chất Simply chai 1 lít,45000,27 × 8 × 8 cm
DAUGOI_BOKET_45,Dầu gội bồ kết trái cây maily 450ml,45000,21 × 7 × 7 cm
DAUGOI_CLEARMEN_48,Dầu gội sạch gàu Clear Men Cool Sport bạc hà 330ml,85000,19 × 6 × 6 cm
DAUGOI_CLEAR_46,Dầu gội sạch gàu Clear mát lạnh bạc hà 854ml,200000,26 × 8.5 × 8.5 cm
DAUGOI_CLEAR_47,Dầu gội sạch gàu Clear mát lạnh bạc hà 330ml,45000,19 × 6 × 6 cm
DAUGOI_DOVE_49,Bộ Dầu gội xả Dove phục hồi hư tổn 330ml/chai,45000,19 × 6 × 6 cm
DAUGOI_DOVE_55,Dầu gội Dove Ceramide phục hồi hư tổn 621ml,45000,24 × 7.5 × 7.5 cm
DAUGOI_FRESH_50,Dầu gội Fresh bồ kết óng mượt rạng ngời 320g,45000,20 × 7 × 7 cm
DAUGOI_H-S_51,Dầu gội sạch gàu Head & Shoulders cho da đầu ngứa 625ml,179000,24 × 8 × 6 cm
DAUGOI_LIFEBOY_56,Dầu gội Lifebuoy tóc dày óng ả 165ml,45000,16 × 5 × 4 cm
DAUGOI_PANTENE_52,Dầu gội Pantene Pro-Vitamin ngăn tóc gãy rụng 900ml,45000,27 × 9 × 7 cm
DAUGOI_REJOICE_58,Dầu gội Rejoice 3 in 1 siêu mềm mượt 320ml,45000,19 × 6 × 5 cm
DAUGOI_SUNSIK_53,Dầu gội Sunsilk mềm mượt diệu kỳ 874ml,45000,26 × 8 × 7 cm
DAUGOI_XMEN_54,Dầu gội nước hoa X-Men Wood thơm lâu sạch sâu 380g,45000,21 × 7 × 6 cm
DAUGOI_XMEN_57,Dầu gội nước hoa X-Men For Boss Intense 380g,153000,21 × 7 × 6 cm
DOHOP_CAMOI_32,Cá nục xốt cà 3 Cô Gái hộp 155g,45000,8 × 8 × 4 cm
DOHOP_VISSAN_64,Heo hầm chay Vissan hộp 150g,45000,8 × 8 × 4 cm
GASAY_DOXACO_60,Gà Sấy Tỏi Ớt Doxaco Gói 100G,44200,15 × 10 × 3 cm
GASAY_TNP_59,Gà sấy lá chanh Thảo Nguyên Phát hũ 100g,45000,8 × 8 × 7 cm
GAXE_DOXACO_61,Gà xé lá chanh 150g (Gói),45000,18 × 10 × 3 cm
GEL_GATSBY_62,Sáp tạo kiểu tóc Gatsby Hard & Free tỉa lớp lãng tử,45000,7 × 7 × 6 cm
GEL_ROMANO_63,Gel vuốt tóc Romano Classic giữ nếp lâu,54000,8 × 8 × 6 cm
HUTIEU_VIFON_65,Hủ Tiếu Sườn Heo Vifon Gói 65G,8900,14 × 10 × 2.5 cm
KEMDANHRANG_COLGATE_66,"Kem đánh răng Colgate thiên nhiên than tre và bạc hà Hàn Quốc khử mùi, sạch khuẩn 180g",45000,19 × 4 × 3.5 cm
KEMDANHRANG_COLGATE_67,Kem Đánh Răng Colgate Maxfresh Than Tre 225Gr Tặng Bàn Chải Đánh Răng,45000,22 × 5 × 4 cm.
KEMDANHRANG_COLGATE_68,Kem đánh răng COLGATE Thiên Nhiên trà xanh 180g (tuýp) - [6920354828119],54900,19 × 4 × 3.5 cm
KEO_DOUBLEMINT_114,Kẹo nhai hương bạc hà DoubleMint hộp 80g,45000,9 × 6 × 2 cm
KEO_KOPIKO_69,Kẹo Coffeeshot Cappuccino Kopiko Gói 140G,16600,17 × 11 × 3 cm
KEO_MENTOS_70,Kẹo ngậm không đường hương spearmint Mentos pure fresh với trà xanh hộp 35g,36000,6 × 4 × 4 cm
KEO_PLAY_71,Kẹo the vị xí muội Play More hũ 22g,26000,5 × 5 × 4 cm
LAUSAN_SUNLIGHT_94,Nước Lau Sàn Sunlight Hương Hoa Hạ & Bạc Hà Tinh Dầu Thảo Mộc 900g,30000,28 × 11 × 7 cm
LAUSAN_SUNLIGHT_95,Nước lau nhà Sunlight Cif hương lily & hoa hồng chai 997ml,45000,29 × 10 × 7 cm
MAMRUOC_HUE_72,Mắm ruốc huế Sông Hương hũ 200g,32000,8 × 8 × 7 cm
MIEN_ACECOOK_85,Miến trộn xốt cua Phú Hương gói 66g,14300,14 × 10 × 2.5 cm
MIEN_PHUHUONG_84,Miến Phú Hương Thịt Bằm 55G,9600,14 × 10 × 2 cm
MI_HAOHAO_74,Mì Hảo Hảo gà vàng gói 74g,45000,15 × 11 × 2.5 cm
MI_HAOHAO_79,Mì Hảo Hảo vị tôm chua cay gói 75g,45000,15 × 11 × 2.5 cm
MI_LAUTHAI_80,Mì Lẩu Thái tôm gói 81g,45000,15 × 11 × 3 cm
MI_OMACHI_73,Mì bò nấu dưa chua Omachi 102 gói 120g,12900,16 × 12 × 3.5 cm
MI_OMACHI_76,Mì khoai tây Omachi sườn hầm ngũ quả ly 115g (có cây thịt thật),17900,11 × 11 × 10 cm
MI_OMACHI_78,Mì nấu Omachi 4 phút vị bò hầm gói 100g,45000,16 × 12 × 3 cm
MI_OMACHI_81,Mì trộn Omachi xốt tôm phô mai trứng muối hộp 105g,16000,13 × 13 × 7 cm
MI_OMACHI_87,Mì khoai tây Omachi tôm chua cay Thái ly 111g (có cây thịt thật),45000,11 × 11 × 10 cm
MI_OMACHI_88,Mì khoai tây Omachi sườn hầm ngũ quả hộp 95g,14400,13 × 13 × 6 cm
MI_VIFON_75,Mì Hai Tôm Vifon gói 75g (có gói dầu sa tế),45000,15 × 11 × 2.5 cm
MI_VIFON_77,Mì lẩu Thái Tomyum Vifon Ngon Ngon ly 60g,9500,9 × 9 × 8 cm
MI_VIFON_82,Mì trộn xốt gà chua cay Vifon ly 75g,45000,9 × 9 × 8 cm
MI_VIFON_83,Mì Xào Vifon Tương Đen Khay 90G,13800,18 × 13 × 3 cm
MUOIOT_TOXACO_86,Muối Ớt Tôm Chay 80g,16500,10 × 7 × 3 cm
NEW_CBONGCAHOI_1,Chà Bông Cá Hồi Salmon Flake Việt EU (150g)/ 200g/ 65g,130000,9 × 9 × 10 cm
NGUCOC_BFAST_89,Ngũ cốc dinh dưỡng VinaCafé B'fast bịch 500g,67500,23 × 16 × 6 cm
NGUCOC_NUTI_90,Ngũ cốc dinh dưỡng nguyên cám NutiFood bịch 500g,49000,23 × 16 × 6 cm
NUOCCAM_TWISTER_91,Nước cam ép Twister Tropicana 1 lít,24000,27 × 7 × 7 cm
NUOCHOA_XMEN_92,Xịt khử mùi X-Men For Boss Legend 150ml,61000,15 × 4 × 4 cm
NUOCMAM_HUNGTHINH_96,Nước mắm cá cơm siêu hạng Hưng Thịnh 35 độ đạm chai 620ml,58000,30 × 7 × 7 cm
NUOCTUONG_TTT_110,Nước tương Nhị Ca Tam Thái Tử chai 500ml,8800,28 × 6 × 6 cm
NUOC_AQUAFINA_93,Nước tinh khiết Aquafina 500ml,45000,24 × 6 × 6 cm
NUOC_PEPSI_97,Nước ngọt Pepsi Cola lon 320ml,45000,"12,5 × 6,5 × 6,5 cm"
NUOC_PEPSI_98,Nước ngọt Pepsi Cola chai 1.5 lít,45000,32 × 8 × 8 cm
NUOC_PEPSI_99,Nước ngọt Pepsi Cola lon 320ml,45000,"12,5 × 6,5 × 6,5 cm"
NUOC_REDBULL_107,Nước tăng lực Redbull Thái lon 250ml,45000,"11,5 × 6 × 6 cm"
NUOC_REDBULL_108,Nước tăng lực Redbull Thái lon 250ml,45000,"11,5 × 6 × 6 cm"
NUOC_STING_100,Nước tăng lực Sting hương dâu 330ml,45000,14 × 6 × 6 cm
NUOC_WAKEUP 247_101,Nước tăng lực Wake Up 247 vị cà phê 330ml,45000,14 × 6 × 6 cm
NUOC_WAKEUP 247_102,Nước tăng lực Wake Up 247 vị cà phê 330ml,45000,14 × 6 × 6 cm
NUOC_WAKEUP247_101,6 chai nước tăng lực Wake Up 247 vị cà phê 330ml,45000,14 × 6 × 6 cm
NUOC_WAKEUP247_102,Nước tăng lực Wake Up 247 vị cà phê 330ml,45000,14 × 6 × 6 cm
NUOC_WAKUP 247_101,6 chai nước tăng lực Wake Up 247 vị cà phê 330ml,45000,14 × 6 × 6 cm
NUOC_WARRIOR_109,Nước tăng lực Warrior hương dâu lon 325ml,45000,"13,5 × 6,5 × 6,5 cm"
RUACHEN_SUNLIGHT_103,Nước rửa chén Sunlight Chanh 100 đánh bay dầu mỡ cứng đầu chai 725ml,45000,"27 × 8,5 × 6,5 cm"
RUACHEN_SUNLIGHT_104,Nước rửa chén Sunlight thiên nhiên lô hội chai 717ml,45000,"27 × 8,5 × 6,5 cm"
RUATAY_LIFEBOY_105,Nước rửa tay Lifebuoy bảo vệ vượt trội chai 177ml,34000,15 × 6 × 4 cm
SNACK_INDOCHIPS_116,Snack phồng mực Oishi Indo Chips gói 32g,6000,17 × 12 × 4 cm
SNACK_POCA_115,Đậu phộng vị nước cốt dừa Poca Nutz gói 75g,12300,18 × 13 × 4 cm
SUADAC_DAIRYCHAMP_118,Combo 2 hộp Sữa Đặc Có Đường Dairy Champ Lon 1Kg,114000,22 × 11 × 11 cm
SUADAC_ONGTHO_119,Sữa đặc có đường Ông Thọ Trắng nhãn xanh lon 380g,27000,"8,5 × 8,5 × 10 cm"
SUADAC_VINAMILK_120,Kem đặc có đường Ngôi sao Phương Nam Xanh lá hộp 380g,45000,"8,5 × 8,5 × 10 cm"
SUATAM_FRESH_127,Sữa tắm sáng da Fresh hương hoa tử linh lan 1.2kg,119000,"28 × 11 × 7,5 cm"
SUATAM_HAZELINE_123,Sữa tắm dưỡng sáng Hazeline matcha lựu đỏ 800g,45000,25 × 10 × 7 cm
SUATAM_LIFEBOY_124,Sữa tắm Lifebuoy công thức Vitamin + bảo vệ khỏi 99.9% vi khuẩn gây bệnh 245ml,45000,"17 × 7 × 4,5 cm"
SUATAM_ROMANO_126,Sữa tắm sạch khuẩn Romano Attitude 180g,45000,15 × 6 × 4 cm
SUATAM_VASELINE_122,Sữa tắm dưỡng ẩm Vaseline Healthy Moisturizing Body Wash,190000,26 × 10 × 7 cm
SUATAM_XMEN_125,Sữa tắm Xmen Fire Active 650g - 17159,179900,24 × 9 × 7 cm
SUA_LADY_129,Lốc 4 hộp sữa tươi tiệt trùng không đường Dutch Lady 180ml,33000,12 × 10 × 4 cm
SUA_MILKMILK_117,Sữa Milk Milk Canxi người già 900g,160000,20 × 12 × 12 cm
SUA_MILO_128,Lốc 4 hộp sữa lúa mạch Milo 180ml,45000,12 × 10 × 4 cm
SUA_OVALTINE_130,Bột thức uống lúa mạch vị chocolate Ovaltine hũ 400g,45000,13 × 9 × 9 cm
SUA_SUSU_121,Lốc 6 chai sữa chua uống tiệt trùng cam SuSu có thạch 80ml,45000,13 × 9 × 6 cm
SUCMIENG_LISTERINE_106,Nước súc miệng Listerine Cool Mint hương bạc hà 750ml,152000,24 × 9 × 7 cm
TAYRUA_DUCK_111,Nước tẩy bồn cầu Duck hương cam quýt chai 500ml,45000,23 × 8 × 6 cm
TAYRUA_VIM_42,Vim Tẩy Bồn Cầu Diệt Khuẩn 900ml Đậm Đặc Diệt Mọi Vi khuẩn,58000,28 × 10 × 7 cm
TRA_C2_140,Trà xanh C2 hương chanh 225ml,45000,"17 × 5,5 × 5,5 cm"
TRA_FUZETEA_135,Trà đào và hạt chia Fuze Tea 450ml,10000,21 × 6 × 6 cm
TRA_HOACUC_136,Trà hoa cúc hán linh,60000,13 × 9 × 6 cm
TRA_KODO_141,6 chai trà xanh Không Độ vị chanh 455ml,45000,23 × 15 × 10 cm
TRA_LIPTON_138,Trà đen túi lọc Lipton nhãn vàng hộp 50g (25 túi x 2g) phiên bản tết,45000,8 × 8 × 7 cm
TRA_LIPTON_139,Trà Chanh Lipton Chanh Mật Ong Hộp 16 Gói 12G,41700,10 × 8 × 6 cm
TRA_TEA-_137,Trà ô long Tea Plus 320ml,45000,18 × 6 × 6 cm
XITCONTRUNG_JUMBO_131,Bình xịt muỗi Jumbo Vape F10 hương cam chanh 600ml,59000,"29 × 6,5 × 6,5 cm"
XITCONTRUNG_KINGSTAR_133,"Bình xịt muỗi, kiến, côn trùng KING STAR 600ml",45000,"29 × 6,5 × 6,5 cm"
XITCONTRUNG_MENG_131,"2 Bình xịt muỗi, kiến, côn trùng WUDIJIAN 600ml",45000,"29 × 13 × 6,5 cm"
XITCONTRUNG_RAID_134,Bình xịt côn trùng Raid không mùi 600ml,72000,"29 × 6,5 × 6,5 cm"
XITPHONG_SPRING_142,Nước hoa xịt phòng Spring Hương Hồng Phấn 280ml,45000,"21 × 5,5 × 5,5 cm"
XITPHONG_SPRING_143,Nước hoa xịt phòng Spring hương phấn 250ml,34500,20 × 5 × 5 cm
XUCXICH_BEKHOE_144,Xúc xích vị heo hầm hạt sen Bé Khoẻ gói 115g (5 cây x 23g),45000,14 × 10 × 2 cm
XUCXICH_VISSAN_145,Xúc xích bò tiệt trùng Vissan gói 90g (5 cây x 18g),10900,13 × 9 × 2 cm
YEN_KHANHHOA_146,Hộp nước yến sào Sanest Không Đường lon 190ml (6 lon),51767,12 × 18 × 12 cm
YEN_KHANHHOA_148,Nước yến sào Khánh Hòa 70ml,35000,"9 × 4,5 × 4,5 cm"
YEN_KHANHHOA_149,Nước yến sào Khánh Hòa 70ml,35000,"9 × 4,5 × 4,5 cm"
YEN_QUEENEST_147,"nước yến queenest ,tổ yến thiên nhiên",200000,22 × 15 × 8 cm
YEN_QUEENEST_150,Lô 6 Nước Yến Queenest 70Ml,200000,22 × 15 × 8 cm
YEN_SAVINEST_112,Yến sào Khánh Hòa Sanest (hộp 6 lọ x 70ml),195000,22 × 15 × 8 cm
YEN_SAVINEST_113,[Siêu thị WinMart] - Nước yến sào cao cấp Khánh Hòa Sanest hộp 6 lọx70ml,255000,24 × 15 × 8 cm
poca,Đậu phộng da cá vị nước cốt dừa Poca gói 42g,45000,12 × 8 × 2 cm
